{
  "$schema": "https://json-schema.org/draft/2020-12/schema",
  "$id": "https://github.com/ajaiupadhyaya/ohcamel-alpha/interface/signal.v2.schema.json",
  "title": "OhCamel signal, v2 (intraday)",
  "description": "One document per intraday signal, written by the Python research layer and enforced by the OCaml core. The core treats every temporal field as a claim to be checked against its own clock. See interface/README.md, section 'v2 - intraday', for the rules (R1-R7 and R9) and docs/superpowers/specs/2026-10-11-autonomous-paper-trading-design.md section 4.3 for why each field exists.",
  "type": "object",
  "additionalProperties": false,
  "required": [
    "schema_version",
    "strategy",
    "params_hash",
    "as_of",
    "bar",
    "horizon",
    "computed_at",
    "data_hash",
    "sequence",
    "validation",
    "targets"
  ],
  "properties": {
    "schema_version": { "const": 2 },
    "strategy": {
      "type": "string",
      "pattern": "^[a-z][a-z0-9_]{1,63}$",
      "description": "Slug. Must be registered with the core (R2)."
    },
    "params_hash": {
      "type": "string",
      "pattern": "^sha256:[0-9a-f]{64}$",
      "description": "SHA-256 of the canonical (sorted-key, no-whitespace) JSON of the strategy parameters."
    },
    "as_of": {
      "type": "string",
      "format": "date-time",
      "pattern": "^[0-9]{4}-[0-9]{2}-[0-9]{2}T[0-9]{2}:[0-9]{2}:[0-9]{2}(\\.[0-9]+)?Z$",
      "description": "The instant, RFC 3339 UTC, of the CLOSE of the bar the signal was computed from. Checked against the desk's cached venue clock (R3, R4) and corroborated by the desk's own ticks (R9)."
    },
    "bar": {
      "enum": ["1Min", "5Min", "15Min", "30Min"],
      "description": "The bar length the producer read. R9 needs a desk tick at or after as_of minus this length for every target."
    },
    "horizon": {
      "enum": ["carry", "close"],
      "description": "carry: the position may be held past the session. close: the desk flattens it at the book's flatten_at."
    },
    "computed_at": {
      "type": "string",
      "format": "date-time",
      "description": "Wall-clock time of computation, RFC 3339 UTC. Informational; the core does not act on it."
    },
    "data_hash": {
      "type": "string",
      "pattern": "^sha256:[0-9a-f]{64}$",
      "description": "SHA-256 over the bars the strategy read, so the core can verify Python saw the data the core has (R8, Phase 2)."
    },
    "sequence": {
      "type": "integer",
      "minimum": 1,
      "description": "Monotonic per strategy. A file at or below the last accepted sequence is rejected (R5)."
    },
    "validation": {
      "type": "object",
      "additionalProperties": false,
      "required": ["status", "gates_version"],
      "properties": {
        "status": {
          "enum": ["pass", "fail", "unvalidated"],
          "description": "Only pass may trade (R6). fail and unvalidated are advisory: logged, never sized."
        },
        "gates_version": {
          "type": "string",
          "description": "Version of docs/CHARTER.md gates the battery applied, e.g. 2026-09-02."
        },
        "dsr": { "type": ["number", "null"], "description": "Deflated Sharpe Ratio." },
        "psr": { "type": ["number", "null"], "description": "Probabilistic Sharpe Ratio, Pr(true Sharpe > 0)." },
        "pbo": { "type": ["number", "null"], "description": "Probability of Backtest Overfitting." },
        "manifest": {
          "type": ["string", "null"],
          "description": "Path or content hash of the battery manifest this block was written from."
        }
      }
    },
    "targets": {
      "type": "array",
      "description": "Target portfolio weights. Each |weight| <= 1 and the sum of |weight| <= 1 (R7). An empty array means flat.",
      "items": {
        "type": "object",
        "additionalProperties": false,
        "required": ["symbol", "weight"],
        "properties": {
          "symbol": { "type": "string", "pattern": "^[A-Z][A-Z0-9.]{0,9}$" },
          "weight": { "type": "number", "minimum": -1, "maximum": 1 }
        }
      }
    }
  }
}
